{
  "schema_version": "data-contract/1.0.0",
  "data_version": "synthetic-base/1.0.0",
  "scenario_id": "SCN-A-USDA-PROTEIN-DELAY",
  "scenario_version": "scenario-a/1.0.0",
  "seed": 20260713,
  "display_name": "USDA protein shipment delay",
  "planning_date": "2026-08-03",
  "forecast_week_starts": ["2026-08-03", "2026-08-10", "2026-08-17", "2026-08-24"],
  "primary_risk_type": "SHORTAGE",
  "provenance": {
    "mode": "SYNTHETIC",
    "created_by": "NourishOps build-context team",
    "description": "Hero scenario overlay derived from a fictional operations notice.",
    "derived_from_ids": ["INB-USDA-PROTEIN-104", "EVD-A-USDA-DELAY-NOTICE"]
  },
  "overlay": {
    "remove_inbound_ids": [],
    "inbound_mutations": [
      {
        "inbound_id": "INB-USDA-PROTEIN-104",
        "set": {
          "expected_week_start": "2026-08-17",
          "status": "PROBABLE",
          "arrival_probability": 0.65
        }
      }
    ],
    "warehouse_overrides": {}
  },
  "active_offer_ids": [],
  "enabled_action_ids": [
    "ACT-A-PURCHASE-PROTEIN-15000",
    "ACT-A-TRANSFER-PROTEIN-8000",
    "ACT-A-DONOR-REQUEST-PROTEIN-15000",
    "ACT-A-MONITOR",
    "ACT-A-PURCHASE-PROTEIN-25000",
    "ACT-A-PURCHASE-PROTEIN-LATE-15000"
  ],
  "active_evidence_ids": [
    "EVD-BASE-INBOUND-LEDGER",
    "EVD-A-USDA-DELAY-NOTICE",
    "EVD-A-VENDOR-STANDARD",
    "EVD-A-PEER-TRANSFER",
    "EVD-A-DONOR-ASSUMPTION",
    "EVD-A-VENDOR-OVERSIZED",
    "EVD-A-VENDOR-LATE"
  ],
  "cached_notice_extraction": {
    "inbound_id": "INB-USDA-PROTEIN-104",
    "previous_week_start": "2026-08-03",
    "revised_week_start": "2026-08-17",
    "status": "PROBABLE"
  }
}
